Platform Name,Jurisdiction of Origin,Pillar,Lead Organization,Description,Partners,Open Source + Repo,Link
Sistema Electrónico para la Contratación Pública (SECOP II),Colombia,Procurement,Colombia Compra Eficiente,"Launched in 2015, SECOP II uses the Open Contracting Data Standard to make collecting, exchanging, and analyzing procurement data faster and more reliable.  The system can also assess market competition in real time using integrated business intelligence tools.",Open Contracting Partnership,No,https://www.colombiacompra.gov.co/secop-ii
Government e-Marketplace (GeM),India,Procurement,"Directorate General of Supplies & Disposal, Ministry of Commerce and Industry","GeM aims to enhance transparency, efficiency and speed in public procurement. It provides the tools of e-bidding, reverse e-auction and demand aggregation to help governments achieve the best value for their money and hence, use taxpayers’ money efficiently. GeM also provides the buyers with an option to select only MSMEs and choose a seller from amongst them. This has helped buyers in significantly increasing share of MSME purchases in their overall procurement of goods and services.",National eGovernance Division (Ministry of Electronics and Information Technology),No,https://gem.gov.in/
Compranet,Mexico,Procurement,"Secretariat of Public Administration, Government of Mexico","Compranet is a publicly accessible online portal through which relevant information is made available to private contractors through an open registry. While law requires that all projects be tendered competitively, exemption clauses do not enforce public disclosure for non-major projects.",OECD,No,https://compranet.hacienda.gob.mx/web/login.html
BASE Portal,Portugal,Procurement,"Instituto dos Mercados Públicos, do Imobiliário e da Construção (IMPIC)","Base Portal aggregates key data points on public contracts, such as calls for tenders, bids that have concluded, and penalties imposed for breaches of the Public Contracts Code. It also disseminates technical content and legislation relevant to bids, while providing transparency to citizens by empowering them to monitor public spending. Currently there is no API to export data to watchdog groups",N/A,No,http://www.base.gov.pt
Government Electronic Business (GeBIZ),Singapore,Procurement,"Ministry of Finance, Government of Singapore","GeBIZ is the Singapore Government's integreated e-procurement portal. All the public sector's invitations for quotations and tenders are posted on GeBIZ. Suppliers can search for government procurement opportunities, download tender documents, and submit their bids online. GeBIZ allows any supplier to access public sector business opportunities anywhere and anytime with just an Internet connection.","Defence Science and Technology Agency, Infocomm Development Authority of Singapore",No,https://www.gebiz.gov.sg/
KONEPS,South Korea,Procurement,Public Procurement Service (PPS),"KONEPS covers the entire procurement cycle electronically  (including  a  one-time  registration,  tendering,  contracts,  inspection  and  payment)  and related documents  are  exchanged  online.  KONEPS  links  about  140  external  systems  to  share  and  retrieve  any necessary information, and provide  a  one-stop service, including automatic  collection of  bidder's qualification data, delivery report, e-invoicing and e-payment. It provides information on a real-time basis.",Korea International Cooperation Agency,No,https://www.pps.go.kr/kor/index.do
Prozorro,Ukraine,Procurement,"Developed by Transparency International, managed by the Ministry of Economic Development and Trade of Ukraine",ProZorro is a fully online public procurement platform and a collaboration environment that ensures open access to public procurement (tenders) in Ukraine. Its hybrid model centralizes database information but allows suppliers and contracting authorities to access data from numerous platforms via API. The system has expanded to also organize sales of insolvent bank property and non-performing loans (Prozorro.Sale) and a private marketplace for commercial tenders (Rialto).,Open Contracting Partnership,https://github.com/openprocurement,https://prozorro.gov.ua/
Prozorro,Ukraine,Procurement,Ukrainain Minister of Economic Development and Trade,"ProZorro is a fully online public procurement platform and a collaboration environment that ensures open access to public procurement (tenders) in Ukraine. Fully implemented in 2016 as a hybrid (both centralized public and decentralized private marketplaces) system it has since been globally recognized as one of the most innovative public procurement systems delivering government services in a stakeholder-focused, transparent, effective, fair and low-cost way.","Open Contracting Partnership, Transparency International, Western NIS Enterprise Fund, USAID",https://github.com/ProzorroUKR,https://www.prozorro.gov.ua/
OpenCRVS,Bangladesh,Public Registries,OpenCRVS team,"OpenCRVS is a civil registration and population data system which will support and maintain the integrity of many other service delivery, statistical and identity management functions. The platform is a digital public good that will provide quality data on birth, death, and cause of death to inform evidence-based decision making. ","Government of Bangladesh CRVS Secretariat, Cabinet Division, Office of the Registrar General, and Directorate General of Health Services",https://github.com/opencrvs,https://www.opencrvs.org/
Population Registry,Estonia,Public Registries,"Ministry of the Interior, Republic of Estonia","The Population Registry is the state’s database for holding basic information about each person living in Estonia. It contains their name, ID code, date of birth, place of residence, and other statistical data such as nationality, native language, education and profession. Each resident can review and correct their data in the register. The register is connected to other systems via X-Road, and a variety of other state systems depend on its data for their services.",N/A,No,https://www.siseministeerium.ee/en/population-register
eVIN,India,Public Registries,"Ministry of Health, Government of India","The Electronic Vaccine Intelligence Network (eVIN) is a smart vaccine logistics system to monitor vaccine stocks and temperatures in real time. It’s a mobile, cloud-based application that allows health workers to update information on vaccine stocks after every immunization session. These updates are stored on a cloud server, so officials can immediately see which vaccines are available.","United Nationa Development Programme, Logistimo",No,https://smartnet.niua.org/content/d9b14fcf-c907-4260-bfd7-3ee9fa94c8d4
DIGIT,Bengaluru Municipal Corporation,Tax and Public Finance,eGov Foundation,"Digital Infrastructure for Governance Impact & Transformation (DIGIT) is a modular technology platform that helps urban local bodies (ULBs) more efficiently and accountably manage operations, track finances, and provide municipal services to citizens through data-driven decision-making.  Its open-source software ensures both interoperability among ULBs and rapid development of new modules by a wide array of software partners.","Municipal Affairs and Urban Development Department, Government of Andhra Pradesh",https://github.com/egovernments,https://www.digit.org/
Indirect Taxation Platform,India,Tax and Public Finance,Goods and Services Tax Network (GSTN),"The platform helps taxpayers in India to prepare, file returns, make payments of indirect tax liabilities and do other compliances. It provides IT infrastructure and services to the central and state governments, taxpayers and other stakeholders for implementation of the Goods and Services Tax (GST) in India.",N/A,No,https://www.gstn.org.in/
South Africa Revenue Service (SARS) e-Filing,South Africa,Tax and Public Finance,South Africa Revenue Service,"The South Africa Revenue Service created an e-filing system that allows citizens to file for their taxes and businesses to register for the VAT.  In 2014, they extented registration requirements for the VAT to foreign suppliers of electronic services. The combination of the legislative requirement and reduced compliance burden through seamless electronic registration led to 200 new business registrations and an additional $161 million USD in tax revenue.",N/A,No,https://www.sarsefiling.co.za/
Thailand Blockchain VAT refund app,Thailand,Tax and Public Finance,"Revenue Department, Ministry of Finance, Thailand","The platform will facilicate VAT refunds for tourists, enabling them to get their refunds quicker and provider greater incentive for foreign tourists to return and increase foreign consumption, investment, and domestic employment. It will also enable entrepreneurs to manage tax returns more efficiently and reduce the cost of processing physical documents. The use of blockchain technology protects the system from fraud and fake invoices.","Thailand Customs Department, the Immigration Bureau of Thailand, Krungthai Bank",No,N/A